,Title,Post Text,ID,Score,Total Comments,Post URL
20,"My new set for Abaddon, hope everyone like it !!!",,13lqz4v,2421,190,https://i.redd.it/holzuu7xgr0b1.gif
21,Dota2 just became an official sport in Sweden,,13tvgi4,2420,138,https://www.svt.se/sport/e-sport/stamman-gick-emot-forbundsstyrelsen-e-sportforbundet-ny-medlem-i-riksidrottsforbundet
22,"Ame, FaithBian, and XinQ in the Maldives now",,13lh0x4,2409,220,https://i.redd.it/bsv660pkeq0b1.jpg
23,HELP! My friends keep making fun of me for picking Hoodwink,"I have a problem. Every game, I pick Hoodwink. It isn't because I'm like a furry or something. I just like how her character plays. They make fun of me and say stuff, like, if I wanna *do* her or something. It's so weird!

&#x200B;

I mean, Hoodwink is definitely an adult based on her lore, but that would still be weird. Sure, she might be in her early-to-mid twenties at the time of the Tomo'kan Incarnation, but she's literally a squirrel. And even though she is certainly intelligent enough to give or receive consent, she's still a squirrel! It's crazy to even think about! Even ignoring the fact that based on her leg-to-body ratio she's definitely of sexual maturity for her species, why would you even say that? Just because, based on in-game measurements, she's large enough to... ""accommodate"" a human, it would **still** be weird.

&#x200B;

I bet they're probably projecting. When they see Hoodwink's adorable green hood in-game they're probably thinking weird stuff like, ""Wow, I wish I could be with her"". I'm not sure what's more disturbing: that they're projecting their sexual fantasies onto the game, or that they're projecting their sexual fantasies onto *me*.

&#x200B;

I bet they could envision their longing gazes, their hearts aflutter with anticipation as they yearned for her to wield the bola with exquisite precision as she lets loose a bushwack. How they secretly craved the moment when her agile paws would release the swirling cords, ensnaring their helpless limbs, and tethering them against the sturdy embrace of a majestic tree. With a mischievous sparkle in her eyes, they probably imagine Hoodwink would scurry up, her soft voice caressing their ears, and a tempting whisper would escape her squirrely lips, ""wanna see what we do for fun around here?"" Their breath would probably hitch, a delicate whimper escaping their lips, captivated by the allure of her sultry geographically specific accent,  resonating with the seductive charm that echoed through her voice as she says ""starting to feel a bit nutty"". But, uh, thoughts like that are weird, and I certainly do NOT think about them.

&#x200B;

How do I get my friends to stop projecting on me like this? I think they need professional help.",13tgklf,2376,262,https://www.reddit.com/r/DotA2/comments/13tgklf/help_my_friends_keep_making_fun_of_me_for_picking/
24,"[Torte de Lini] After 2,533 updates, all 166 Standard Hero Guides are updated to patch 7.33/b/c",,13m1jhq,2256,141,https://i.redd.it/976e2vbolt0b1.png
25,Petition to rename Blood Grenade to Enchanted Tomato,,13n0041,2182,107,https://i.redd.it/sudth4mmn01b1.png
26,"No primariy attribute, no gender - easy",,13e1xii,2171,179,https://i.redd.it/g2l9u8mp32za1.png
27,Why do LCs archers shoot at their commander? are they stupid?,,13vll1q,2168,182,https://i.redd.it/hga103y4ux2b1.png
28,[OC] Shadow Amulet,,13l4wli,2039,78,https://i.redd.it/ktjbc6vcim0b1.jpg
29,tactical twin gate,,13fo7r5,2025,93,https://v.redd.it/2si9y53h4fza1
30,Guys i fixed the logo,,13ifcp1,1956,23,https://i.redd.it/bgz092ibb10b1.png
31,This workshop snapfire cosmetic is straight ultra rare once available in-game,,13u5hwb,1951,155,https://i.redd.it/bxb6ye33an2b1.jpg
32,Storm Spirit can yeet behind Dire's fountain to climb Mount Doom,,140shss,1947,79,https://v.redd.it/jpnc728gs24b1
33,Universal heroes' best stat-heavy item choices - a number comparison cheat sheet,,13vrsjv,1910,188,https://i.redd.it/xow97ct2r03b1.png
34,CM doing her best (@Rikokyu),[Source (NSFW WARNING)](https://twitter.com/Rikokyu/status/1652658391917944833?t=EKjr9b75uc8eVVhtEQICew&s=19),13i8kwt,1890,51,https://i.imgur.com/3CKrlvC.jpg
35,Unveiling ⚙️'Ancient Mechanism'⚙️: A Prehistoric Machinery-themed Clockwerk Set!,,13tyvby,1863,88,https://v.redd.it/m3k2gngxbk2b1
36,"hello guys! sharing this latest piece, a dynamic battle between Zeus and the Sandking.",,13h8x8q,1854,64,https://i.redd.it/5l19cj0gzrza1.png
37,Windranger's arcana voice has thirty-one different responses for the removed item Tome of Knowledge,,142f7s8,1861,144,https://i.redd.it/wv9t91xdae4b1.jpg
38,It has been 1350 DAYS! Since the last expensive dota plus set.,,13kwxvf,1840,129,https://i.redd.it/5ij87xuhem0b1.jpg
39,"Crimson Devil, a set for PUDGE straight out of Hell - Spring CTA 2023",,13rgzyb,1836,207,https://i.redd.it/de0y5m7g4z1b1.gif
40,Yapzor 200iq wisdom rune play,,13s9k0g,1744,104,https://clips.twitch.tv/LivelyFurtiveMinkFeelsBadMan-Qk6mv3m78HVhDeiI
41,"PSA: The Gold Border means they have buyback ready, surprised some people don't know this",,13t1dgr,1731,221,https://i.redd.it/zq5amh7uxb2b1.jpg
42,Bali Major Trophy…,,13ze3qi,1736,91,https://v.redd.it/d0s1ru2c9t3b1
43,"I was pretty sure that I was completely dead here, but Shaker comes in to save the day.",,143r8bz,1806,57,https://v.redd.it/pknbs1je7o4b1
44,I insulted ODs skin but he one-upped me big time,,13l843x,1723,57,https://i.redd.it/ssfjekwy3n0b1.png
45,Dota 2 – Balance Patch 7.33c now available!,,13gzqas,1711,854,http://www.dota2.com/patches/7.33c
46,"Thanks random 8k guy, won an unwinnable game because enemy medusa decided to go treads -> rapier",,13xmz69,1607,257,https://i.redd.it/sw67dyedtf3b1.jpg
47,"disassemble, open slot, disassemble, unlock, unlock, unlock",,13xc4k9,1591,76,https://i.redd.it/miy1c2huad3b1.png
48,I really miss Aether Lens + Octarine Core. It was perfect.,Can't Icefrog have made it more expensive or something instead?,13fyhty,1557,296,https://www.reddit.com/r/DotA2/comments/13fyhty/i_really_miss_aether_lens_octarine_core_it_was/
49,This thread from almost 4 years ago was full of seers,,13rr045,1545,107,https://i.redd.it/peedmb2q412b1.png
50,Tinkering With Turbo,,143torb,1542,361,https://www.dota2.com/newsentry/3692434931953973990
51,"""I said good-day, sir!""",,13sk5le,1497,82,https://v.redd.it/jqa2momvr72b1
52,Tell me you're a Dota 2 Veteran without telling me you're a Dota 2 veteran,"

I'll start with something,



There used to be a Daily Bonus Hero, which gave 2 mangoes on selection at the start of a match.

(*Confused noises*)",1445rgz,1655,3906,https://www.reddit.com/r/DotA2/comments/1445rgz/tell_me_youre_a_dota_2_veteran_without_telling_me/
53,Stop sleeping on Sunsfan's custom game Ability Arena. Huge improvements since launch and it's fun!,"He isn't paying me or anything (but he can if he wants). I just think the game is the best auto battler out there right now and I want to see more people playing it. 

Since launch, they've been really dedicated to updating it. Made the endgame longer so you can actually enjoy your max abilities. Tons of new heroes. Added items. New battlepass. Great animations and sound effects. Very fun gameplay loop and low stress, perfect after grinding ranked all day.

Give it a shot!",13qar9w,1487,186,https://www.reddit.com/r/DotA2/comments/13qar9w/stop_sleeping_on_sunsfans_custom_game_ability/
54,"Good day, Sir! - we did a dapper axe set ""Dressed to Cull"" for spring cta",,13vkyn3,1482,97,https://v.redd.it/dy9vjjh82z2b1
55,Dota names used to be poetic,"Back then, Lich’s Sacrifice wasn’t named that way, it’s “Dark Ritual”. Or Basher, it wasn’t “Skull Basher”, it was “Cranium Brasher”, they are the same thing, but through the non-native speaker eyes, the latter sounds way cooler. Or Circlet, it was “Circlet of Nobility”!

Nowadays, we get item names like Crown or Diadem, skill names like Dispose or Unleash. It’s overly simple, doesn’t feel like it has a lore or a back story that goes with it.

Guess I’m just being nostalgic, but I do wish Icefrog will make more of this fancy names.",13s1uoy,1478,422,https://www.reddit.com/r/DotA2/comments/13s1uoy/dota_names_used_to_be_poetic/
56,Another Interesting set for AM Persona - Nemesis Slayer,,13u0qz6,1436,110,https://i.redd.it/zqzb5g5tsk2b1.png
57,There many fake passages in the trees.,"It looks like your hero can go between the two trees but it actually takes a path around them. Died because of it multiple times now, hopefully it gets fixed.

Edit: Thank you for the comments with your own examples. Also, sorry for the grammar, I typed this one out immediately after dying under the radiant t1 tower as my hero decided to take a path around the trees while 3 enemy heroes were ganking me. ",13eyras,1441,134,https://www.reddit.com/r/DotA2/comments/13eyras/there_many_fake_passages_in_the_trees/
58,Medusa has 0 strength. Tiny has 0 agility. Ogre has 0 intel. Now we need a 0 stat universal hero.,,13i9226,1418,152,https://i.redd.it/wdvmidcc300b1.png
59,It's not much but super proud of my 2k self for this play,,13ljkck,1395,115,https://v.redd.it/8y61ljwqhp0b1
60,Finished a new set for AM Persona - What do you guys think? Hope you like it!,,13s9usc,1376,182,https://www.reddit.com/gallery/13s9usc
61,Mindgames in pubs,,13gzz4j,1372,36,https://i.redd.it/kiru2bxljpza1.png
62,RTZ net worth as Medusa at 22ish minutes (SR vs ALPHA),,13pb7zf,1359,195,https://i.redd.it/o7w1dfv5rh1b1.png
63,Hellspawn Chimera - set for Lion - spring 2023 cta,,13qjpxu,1331,94,https://v.redd.it/f32s2g7rqr1b1
64,Dota+ Summer Update,,13xy58q,1305,181,https://www.dota2.com/newsentry/3718329360979838399
65,Mikey joins Nigma Galaxy as their new mid,,13fhvcg,1302,283,https://twitter.com/NigmaGalaxy/status/1656977531885559808
66,r/Dota2 insists that this is not a bug so i had to make another video,,13ebuem,1288,139,https://v.redd.it/cdujdkfqf4za1
67,Never realize how I take my donkey for granted till i try playing other games. I love my donkey.,,13u7c4a,1281,137,https://i.redd.it/rkbpvzyson2b1.jpg
68,Made a chart showing the base movement speed of all heroes as of 7.33c!,,13tl002,1282,204,https://i.redd.it/178aesiuyh2b1.png
69,"PGL: ""We have ultimately chosen to overturn the decision previously made.""",,13su4r2,1272,218,https://twitter.com/pglesports/status/1662264692784390144
70,Same but different,,13jj9mx,1265,32,https://i.redd.it/i1fvxuger90b1.png
71,Xcalibur opens up in SingSing's stream,"Sing invited him for some unranked games yesterday and Sing pointed out (in a nice way) that Xcalibur's ranked went down by quite a lot, cause last time he checked he was like Rank 1 or something. I couldn't quite interpret some of the stuffs he said but basically his response was 

""I always had problems with my mental state really. So basically my confidence (not ranked confidence) has a lot to do with my mmr actually. And which is very unhealthy. That's something I'm working on and  have to overcome.""  

""I talked with a therapist and I found out that I have like this problem that I take too much responsibility. Ever since like ever since I played. Because every time I lost and I do allow myself to fail because from a very young age since when I started playing I got blamed most of losses. So basically I didn't allow myself to fail (anymore) And it just made confidence worse when I started failing.""


Basically his point is, there are some days where he just doesn't feel as confident about himself in games. There are times where things don't go the way he thought it would be, and then he starts questioning like ""How did this happen?"" and lose confidence. And it affects his games a lot.  


  
People have good days, and bad days. Pointing out their mistakes (in a nice way) isn't that bad but being toxic to someone and telling them stuff like quit/uninstall dota, to hurt, or even kill themselves etc is just immature and unacceptable behavior.",13y7d58,1262,116,https://www.reddit.com/r/DotA2/comments/13y7d58/xcalibur_opens_up_in_singsings_stream/
72,Aster Combo - Sumail 4 man vortex into 4x visage bird stun,,13nogh0,1255,123,https://clips.twitch.tv/EmpathicDreamyWalrusBCWarrior-YEMJ2_J1toK1Mio3
73,3 € / month for this,,13qp1dl,1253,126,https://i.redd.it/07ky7tc6us1b1.png
74,Edible Pudge Set,,13u2awi,1250,95,https://v.redd.it/pyyttjnk5l2b1
75,what is the icon for rot supposed to be? all I can see is a cock with 4 piercings,,13fsfv4,1244,189,https://i.redd.it/takfpn3ywfza1.png
76,"DPC NA Div 2, American goons is disqualified, GateKept will replace",,13rti0z,1229,278,https://twitter.com/pglesports/status/1661841497237364770
77,English SA DPC casters on strike due to wage undercutting and bad management by BTS PT,,13l294m,1233,224,https://twitter.com/Kipspul/status/1659215177966026754
78,A list of people from the Berlin major who think I'm really cool!,,13eopc9,1212,92,https://i.imgur.com/mRK7bdJ.jpg
79,Baby Slark,"Baby Slark, doo-doo, doo-doo
Baby Slark, doo-doo, doo-doo
Baby Slark, doo-doo, doo-doo
Baby Slark",13sbjg0,1213,42,https://i.redd.it/6ou5r001l72b1.jpg
80,New Steam Online Conduct guidelines explicitly forbid smurfing,,13dkaz3,1206,337,https://store.steampowered.com/online_conduct/?snr=2_groupannouncements_detail_
81,7.33c changelogs are not reliable nowadays. Really disappointed.,"Every single patch I just simply DEMO the changes, there's always something basic wrong or unchanged. Honestly, I'm disappointed about the quality of the patches they bring.

Here's what I found in this patch :

    1. PANGOLIER : SWASHBUCKLE Dash Range decreased from 850 to 550/650/750/850

It is unchanged, still 850.

[https://github.com/ValveSoftware/Dota2-Gameplay/issues/9193](https://github.com/ValveSoftware/Dota2-Gameplay/issues/9193)

    2. EARTHSHAKER FISSURE Fissure Range increased from 1400 to 1600

It is unchanged, still 1400.

[https://github.com/ValveSoftware/Dota2-Gameplay/issues/9194](https://github.com/ValveSoftware/Dota2-Gameplay/issues/9194)

    3. SPECIALIST'S ARRAY (+5 all attributes, +12 damage ) 
    Crackshot now deals 20 bonus damage Crackshot now prioritizes heroes as secondary targets

When a ranged hero equips it, the raw +12 damage is replaced with +20 damage until Crackshot is cd.

It should be the raw +12 damage added up to bonus +20 = +32 ?

What's more, when a meele hero equips it, it **always gives raw +20 damage rather than raw +12 damage and crackshot never goes to cooldown.**

[https://github.com/ValveSoftware/Dota2-Gameplay/issues/9192](https://github.com/ValveSoftware/Dota2-Gameplay/issues/9192)

&#x200B;

I can't imagine some of the guys thought their hero is buff or nerf , but actually the changelog is not applied yet.

&#x200B;

**\[UPDATE\]**

1. They have fixed the issues of Earthshaker and Pangolier.
2. SPECIALIST'S ARRAY now deals +32 raw damage until crackshot is into cooldown. **But meele hero still always has the free +32 raw damage because crackshot never goes into cooldown.**

Only one issue left and thank you some of the employees who quickly fix these. Now I can enjoy the earthshaker buff !

\[UPDATE 2 \] All has been fixed perfectly!

They have fixed SPECIALIST'S ARRAY ! Meele hero no long has free +32 raw damage now! Thanks everyone and thank you valve employee for the hard work!",13hba53,1206,116,https://www.reddit.com/r/DotA2/comments/13hba53/733c_changelogs_are_not_reliable_nowadays_really/
82,Perfect World E-Sports show why they deserve to organize more than just DPC in one video,"Come on Valve maybe give them more jobs?

And FR, where did they get their photographers and videographers? They care about every single details and make your faves look even cooler, and this is just for 1 regular DPC tour.

Coincidentally, this is also Sumail's first DPC CN tour so there's no better ""welcome party"" than this.",13tttpg,1187,135,https://v.redd.it/kb75ybqvti2b1
83,One of many bell curves of Dota 2,,13rim89,1193,111,https://i.redd.it/azusywo4z02b1.png
84,Taiga shared a statement where he talks about his situation,,13qybgw,1184,285,https://twitter.com/justopancho/status/1661450950064652288
85,7.33c Echo slam vs 7.33c Medusa,,13hohz8,1173,122,https://www.twitch.tv/videos/1820044614
86,"What the actual fuck is this, how does this even go through Filters.",,13ghm1a,1167,411,https://i.redd.it/j4o81ebvolza1.png
87,Which DotA heroes have stood the test of time by rework history in both DotA and HoN,,13kv0s2,1166,358,https://i.redd.it/3daetykhhk0b1.png
88,The 2 horsemen of apocalypse,,143irvc,1167,143,https://i.redd.it/ffx03a1snm4b1.png
89,YEARLY ARTEEZY STREAM (with cam),,13j9vu7,1153,101,https://www.twitch.tv/arteezy
90,hello guys! it's me again! sharing this last piece for now. Undying Vs Dawnbreaker,,13ov64u,1150,63,https://i.redd.it/5trm3n1ppe1b1.png
91,Gorgc learns top-secret new void spirit tech,,140xfvy,1140,26,https://youtu.be/kSOKwAkym9U
92,Thank you Valve...RIP,,13xyac9,1138,53,https://i.redd.it/77xs91yd2i3b1.png
93,Sumail's first LAN match at CN DPC. PGL plz shows the LAN stage.,,13mhi10,1122,53,https://i.redd.it/r2int84ddy0b1.png
94,Roshan... came back?!!,,13uj4p5,1100,95,https://v.redd.it/4vm6fivbso2b1
95,Add Tormentor Chatwheel for better communication,,13r76k1,1096,96,https://i.redd.it/89zqipgyyx1b1.jpg
96,Love the ES buffs!,,13izy1p,1091,100,https://v.redd.it/6y7ghqfzt50b1
97,AM's counter spell reflects Alchemist's stun without being targeted,,13fef1i,1071,116,https://v.redd.it/gtk17qg9wcza1
98,PA had just purchased a rapier...,,13sxs0j,1066,149,https://v.redd.it/z1wlwkkldc2b1
99,Leavers should not get Wisdom rune XP,"We had a Batrider who abandoned the game at level 4, we are left playing 4 v 5 and every time we took a Wisdom rune for the next 50 mins in this hard fight, the lowest level hero was the Bat, so he kept stealing our Wisdom rune XP even after leaving the game :|",13royb4,1057,54,https://www.reddit.com/r/DotA2/comments/13royb4/leavers_should_not_get_wisdom_rune_xp/
